<?xml version="1.0" encoding="UTF-8"?>
<uncertainties
    xsi:schemaLocation="http://www.wldelft.nl http://datools.wldelft.nl/schemas/v1.3/uncertainties.xsd"
    version="1.0" xmlns="http://www.wldelft.nl" xmlns:xsi="http://www.w3.org/2001/XMLSchema-instance">
    <uncertaintyType>ProbabilityDistributionFunction</uncertaintyType>
    <probabilityDistributionFunction id="WCAP.powst" isActive="false">
        <normal mean="0.0" stdv="0.1" stdvIsFactor="true"/>
    </probabilityDistributionFunction>
    <probabilityDistributionFunction id="WCAP.cds2" isActive="false">
        <normal mean="0.0" stdv="1.7E-6" stdvIsFactor="false"/>
    </probabilityDistributionFunction>
    <probabilityDistributionFunction id="FRIC.cfjon" isActive="true">
        <lognormal mean="0.0" stdv="0.05"/>
    </probabilityDistributionFunction>
    <probabilityDistributionFunction id="BREA.gamma" isActive="false">
        <normal mean="0.0" stdv="0.15" stdvIsFactor="false"/>
    </probabilityDistributionFunction>
    <probabilityDistributionFunction id="TRIAD.trfac" isActive="true">
        <normal mean="0.0" stdv="0.02" stdvIsFactor="false"/>
    </probabilityDistributionFunction>
    <probabilityDistributionFunction id="TRIAD.cutfr" isActive="false">
        <normal mean="0.0" stdv="0.0125" stdvIsFactor="false"/>
    </probabilityDistributionFunction>
</uncertainties>
