<?xml version="1.0" encoding="UTF-8"?>
 <uncertainties xsi:schemaLocation="http://www.wldelft.nl http://datools.wldelft.nl/schemas/v1.3/uncertainties.xsd" version="1.0" xmlns="http://www.wldelft.nl" xmlns:xsi="http://www.w3.org/2001/XMLSchema-instance">

	<uncertaintyType>ProbabilityDistributionFunction</uncertaintyType>

	<probabilityDistributionFunction id="DENHDR.waterlevel" isActive="true">
		<normal mean="0" stdv="0.05" stdvIsFactor="false"/>
	</probabilityDistributionFunction>

	<probabilityDistributionFunction id="ROOMPBTN.waterlevel" isActive="true">
		<normal mean="0" stdv="0.05" stdvIsFactor="false"/>
	</probabilityDistributionFunction>

	<probabilityDistributionFunction id="SCHEVNGN.waterlevel" isActive="true">
		<normal mean="0" stdv="0.05" stdvIsFactor="false"/>
	</probabilityDistributionFunction>

	<probabilityDistributionFunction id="VLISSGN.waterlevel" isActive="true">
		<normal mean="0" stdv="0.05" stdvIsFactor="false"/>
	</probabilityDistributionFunction>

	<probabilityDistributionFunction id="WESTKPLE.waterlevel" isActive="true">
		<normal mean="0" stdv="0.05" stdvIsFactor="false"/>
	</probabilityDistributionFunction>

</uncertainties>
